{
  "$schema": "../../schema/brand.schema.json",
  "schema": "miniature-paints/v4",
  "displayName": "Warhammer Colour",
  "company": "Games Workshop Limited",
  "address": {
    "street": "Willow Road, Lenton",
    "city": "Nottingham",
    "postcode": "NG7 2WS",
    "country": "United Kingdom"
  },
  "contactEmail": "uk.custserv@gwplc.com",
  "contactForm": "",
  "website": "https://www.warhammer.com",
  "phone": "+44 115 91 40000",
  "updatedCatalogueRequested": "24/06/2026",
  "paintCount": 331,
  "paints": [
    {
      "id": "warhammer-colour-abaddon-black",
      "name": "Abaddon Black",
      "code": null,
      "set": "Air",
      "hex": "#000000",
      "rgb": {
        "r": 0,
        "g": 0,
        "b": 0
      },
      "shiftColors": null,
      "colourless": false,
      "potSizes": [
        {
          "raw": "24ml",
          "value": 24,
          "unit": "ml"
        }
      ],
      "description": null
    },
    {
      "id": "warhammer-colour-abaddon-black-2",
      "name": "Abaddon Black",
      "code": null,
      "set": "Base",
      "hex": "#000000",
      "rgb": {
        "r": 0,
        "g": 0,
        "b": 0
      },
      "shiftColors": null,
      "colourless": false,
      "potSizes": [
        {
          "raw": "12ml",
          "value": 12,
          "unit": "ml"
        }
      ],
      "description": null
    },
    {
      "id": "warhammer-colour-administratum-grey",
      "name": "Administratum Grey",
      "code": null,
      "set": "Air",
      "hex": "#9DA49D",
      "rgb": {
        "r": 157,
        "g": 164,
        "b": 157
      },
      "shiftColors": null,
      "colourless": false,
      "potSizes": [
        {
          "raw": "24ml",
          "value": 24,
          "unit": "ml"
        }
      ],
      "description": null
    },
    {
      "id": "warhammer-colour-administratum-grey-2",
      "name": "Administratum Grey",
      "code": null,
      "set": "Layer",
      "hex": "#999C95",
      "rgb": {
        "r": 153,
        "g": 156,
        "b": 149
      },
      "shiftColors": null,
      "colourless": false,
      "potSizes": [
        {
          "raw": "12ml",
          "value": 12,
          "unit": "ml"
        }
      ],
      "description": null
    },
    {
      "id": "warhammer-colour-aeldari-emerald",
      "name": "Aeldari Emerald",
      "code": null,
      "set": "Contrast",
      "hex": "#328275",
      "rgb": {
        "r": 50,
        "g": 130,
        "b": 117
      },
      "shiftColors": null,
      "colourless": false,
      "potSizes": [
        {
          "raw": "18ml",
          "value": 18,
          "unit": "ml"
        }
      ],
      "description": null
    },
    {
      "id": "warhammer-colour-aethermatic-blue",
      "name": "Aethermatic Blue",
      "code": null,
      "set": "Contrast",
      "hex": "#118590",
      "rgb": {
        "r": 17,
        "g": 133,
        "b": 144
      },
      "shiftColors": null,
      "colourless": false,
      "potSizes": [
        {
          "raw": "18ml",
          "value": 18,
          "unit": "ml"
        }
      ],
      "description": null
    },
    {
      "id": "warhammer-colour-aggaros-dunes",
      "name": "Aggaros Dunes",
      "code": null,
      "set": "Contrast",
      "hex": "#D3BD79",
      "rgb": {
        "r": 211,
        "g": 189,
        "b": 121
      },
      "shiftColors": null,
      "colourless": false,
      "potSizes": [
        {
          "raw": "18ml",
          "value": 18,
          "unit": "ml"
        }
      ],
      "description": null
    },
    {
      "id": "warhammer-colour-agrax-earthshade",
      "name": "Agrax Earthshade",
      "code": null,
      "set": "Shade",
      "hex": "#9A998E",
      "rgb": {
        "r": 154,
        "g": 153,
        "b": 142
      },
      "shiftColors": null,
      "colourless": false,
      "potSizes": [
        {
          "raw": "18ml",
          "value": 18,
          "unit": "ml"
        }
      ],
      "description": null
    },
    {
      "id": "warhammer-colour-agrellan-badland",
      "name": "Agrellan Badland",
      "code": null,
      "set": "Technical",
      "hex": "#86775E",
      "rgb": {
        "r": 134,
        "g": 119,
        "b": 94
      },
      "shiftColors": null,
      "colourless": false,
      "potSizes": [
        {
          "raw": "24ml",
          "value": 24,
          "unit": "ml"
        }
      ],
      "description": null
    },
    {
      "id": "warhammer-colour-agrellan-earth",
      "name": "Agrellan Earth",
      "code": null,
      "set": "Technical",
      "hex": "#AA997D",
      "rgb": {
        "r": 170,
        "g": 153,
        "b": 125
      },
      "shiftColors": null,
      "colourless": false,
      "potSizes": [
        {
          "raw": "24ml",
          "value": 24,
          "unit": "ml"
        }
      ],
      "description": null
    },
    {
      "id": "warhammer-colour-ahriman-blue",
      "name": "Ahriman Blue",
      "code": null,
      "set": "Layer",
      "hex": "#297189",
      "rgb": {
        "r": 41,
        "g": 113,
        "b": 137
      },
      "shiftColors": null,
      "colourless": false,
      "potSizes": [
        {
          "raw": "12ml",
          "value": 12,
          "unit": "ml"
        }
      ],
      "description": null
    },
    {
      "id": "warhammer-colour-air-caste-thinner",
      "name": "Air Caste Thinner",
      "code": null,
      "set": "Air",
      "hex": "#FFFFFF",
      "rgb": {
        "r": 255,
        "g": 255,
        "b": 255
      },
      "shiftColors": null,
      "colourless": false,
      "potSizes": [
        {
          "raw": "24ml",
          "value": 24,
          "unit": "ml"
        }
      ],
      "description": null
    },
    {
      "id": "warhammer-colour-akhelian-green",
      "name": "Akhelian Green",
      "code": null,
      "set": "Contrast",
      "hex": "#0F8FA8",
      "rgb": {
        "r": 15,
        "g": 143,
        "b": 168
      },
      "shiftColors": null,
      "colourless": false,
      "potSizes": [
        {
          "raw": "18ml",
          "value": 18,
          "unit": "ml"
        }
      ],
      "description": null
    },
    {
      "id": "warhammer-colour-alaitoc-blue",
      "name": "Alaitoc Blue",
      "code": null,
      "set": "Layer",
      "hex": "#384F83",
      "rgb": {
        "r": 56,
        "g": 79,
        "b": 131
      },
      "shiftColors": null,
      "colourless": false,
      "potSizes": [
        {
          "raw": "12ml",
          "value": 12,
          "unit": "ml"
        }
      ],
      "description": null
    },
    {
      "id": "warhammer-colour-altdorf-guard-blue",
      "name": "Altdorf Guard Blue",
      "code": null,
      "set": "Layer",
      "hex": "#354694",
      "rgb": {
        "r": 53,
        "g": 70,
        "b": 148
      },
      "shiftColors": null,
      "colourless": false,
      "potSizes": [
        {
          "raw": "12ml",
          "value": 12,
          "unit": "ml"
        }
      ],
      "description": null
    },
    {
      "id": "warhammer-colour-angron-red-clear",
      "name": "Angron Red Clear",
      "code": null,
      "set": "Air",
      "hex": "#F67E88",
      "rgb": {
        "r": 246,
        "g": 126,
        "b": 136
      },
      "shiftColors": null,
      "colourless": false,
      "potSizes": [
        {
          "raw": "24ml",
          "value": 24,
          "unit": "ml"
        }
      ],
      "description": null
    },
    {
      "id": "warhammer-colour-apothecary-white",
      "name": "Apothecary White",
      "code": null,
      "set": "Contrast",
      "hex": "#F1F9FE",
      "rgb": {
        "r": 241,
        "g": 249,
        "b": 254
      },
      "shiftColors": null,
      "colourless": false,
      "potSizes": [
        {
          "raw": "18ml",
          "value": 18,
          "unit": "ml"
        }
      ],
      "description": null
    },
    {
      "id": "warhammer-colour-ardcoat",
      "name": "Ardcoat",
      "code": null,
      "set": "Technical",
      "hex": "#F2F2F2",
      "rgb": {
        "r": 242,
        "g": 242,
        "b": 242
      },
      "shiftColors": null,
      "colourless": false,
      "potSizes": [
        {
          "raw": "24ml",
          "value": 24,
          "unit": "ml"
        }
      ],
      "description": null
    },
    {
      "id": "warhammer-colour-armageddon-dust",
      "name": "Armageddon Dust",
      "code": null,
      "set": "Technical",
      "hex": "#D1C26B",
      "rgb": {
        "r": 209,
        "g": 194,
        "b": 107
      },
      "shiftColors": null,
      "colourless": false,
      "potSizes": [
        {
          "raw": "24ml",
          "value": 24,
          "unit": "ml"
        }
      ],
      "description": null
    },
    {
      "id": "warhammer-colour-astorath-red",
      "name": "Astorath Red",
      "code": null,
      "set": "Dry",
      "hex": "#AA311E",
      "rgb": {
        "r": 170,
        "g": 49,
        "b": 30
      },
      "shiftColors": null,
      "colourless": false,
      "potSizes": [
        {
          "raw": "12ml",
          "value": 12,
          "unit": "ml"
        }
      ],
      "description": null
    },
    {
      "id": "warhammer-colour-astrogranite",
      "name": "Astrogranite",
      "code": null,
      "set": "Technical",
      "hex": "#919191",
      "rgb": {
        "r": 145,
        "g": 145,
        "b": 145
      },
      "shiftColors": null,
      "colourless": false,
      "potSizes": [
        {
          "raw": "24ml",
          "value": 24,
          "unit": "ml"
        }
      ],
      "description": null
    },
    {
      "id": "warhammer-colour-asurmen-blue",
      "name": "Asurmen Blue",
      "code": null,
      "set": "Contrast",
      "hex": "#277EAB",
      "rgb": {
        "r": 39,
        "g": 126,
        "b": 171
      },
      "shiftColors": null,
      "colourless": false,
      "potSizes": [
        {